{
  "$schema": "https://json-schema.org/draft/2020-12/schema",
  "title": "ContextOperation",
  "type": "object",
  "required": [
    "id",
    "operation",
    "status",
    "actor_id",
    "created_at"
  ],
  "properties": {
    "id": {
      "type": "string",
      "description": "Stable identifier for this portable OACS record."
    },
    "operation": {
      "type": "string",
      "enum": [
        "context.build",
        "context.explain",
        "context.reduce",
        "context.expand",
        "context.lock",
        "context.export",
        "context.import"
      ],
      "description": "Standard operation name represented by this envelope."
    },
    "status": {
      "type": "string",
      "enum": [
        "requested",
        "completed",
        "denied",
        "failed"
      ],
      "description": "Lifecycle status for this record in the portable OACS model."
    },
    "actor_id": {
      "type": [
        "string",
        "null"
      ],
      "description": "Optional actor identifier associated with this operation or projection."
    },
    "agent_id": {
      "type": [
        "string",
        "null"
      ],
      "description": "Optional agent identifier associated with this operation or projection."
    },
    "capsule_id": {
      "type": [
        "string",
        "null"
      ],
      "description": "Optional ContextCapsule identifier associated with this context operation."
    },
    "scope": {
      "type": "array",
      "items": {
        "type": "string"
      },
      "description": "Portable scope labels that constrain where the record applies."
    },
    "token_budget": {
      "type": [
        "integer",
        "null"
      ],
      "description": "Token budget requested or used by this context operation."
    },
    "arguments": {
      "type": "object",
      "description": "Portable operation arguments; implementations may map them to local APIs."
    },
    "result": {
      "type": "object",
      "description": "Portable operation result envelope; implementations may include adapter-neutral details."
    },
    "audit_event_id": {
      "type": [
        "string",
        "null"
      ],
      "description": "AuditEvent identifier associated with this operation."
    },
    "created_at": {
      "type": "string",
      "description": "Creation timestamp encoded as a portable string."
    }
  },
  "additionalProperties": false
}
