{
  "id": "cop_conformance_001",
  "operation": "context.build",
  "status": "completed",
  "actor_id": "act_agent_001",
  "agent_id": "agent_runtime_001",
  "capsule_id": "ctx_conformance_001",
  "scope": [
    "project",
    "repo:oacs"
  ],
  "token_budget": 4000,
  "arguments": {
    "intent": "answer_project_question"
  },
  "result": {
    "included_memories": [
      "mem_conformance_001"
    ],
    "evidence_refs": [
      "ev_conformance_001"
    ]
  },
  "audit_event_id": "aud_conformance_002",
  "created_at": "2026-05-03T00:00:01Z"
}
